{"type":"rsp","id":7,"ok":true,"data":{"queue_depth_now":0,"queue_depth_cap":32,"queue_depth_high_watermark":5,"overflow":"drop_oldest","dispatch_threads":1,"dropped":0,"dropped_lifetime":3,"queue_depth_high_watermark_lifetime":9,"malformed_cmd_rejected_lifetime":0,"crash_leaked_docs_lifetime":0,"last_emit_age_ms":12,"sources":[{"source":"cam0","last_emit_age_ms":12},{"source":"cam1","last_emit_age_ms":-1}]}}
